{
  "schema_version": "0.5.0",
  "record_type": "cache_entry",
  "cache_entry_id": "cache:example",
  "cache_scope": "project_local",
  "content_class": "source_derived",
  "input_digests": [
    "sha256:dddddddddddddddddddddddddddddddddddddddddddddddddddddddddddddddd"
  ],
  "output_refs": [
    {
      "record_type": "parser_result",
      "record_id": "parser-result:example"
    }
  ],
  "contains_source_derived_information": true,
  "cross_repository_reuse_allowed": false,
  "dependency_keys": [
    "parser:python@0.5.0"
  ],
  "created_at": "2026-07-27T12:00:03Z",
  "last_validated_at": "2026-07-27T12:00:04Z",
  "provenance": {
    "actor": {
      "actor_kind": "controller",
      "actor_id": "software:sc-referee-controller",
      "display_name": "sc-referee controller"
    },
    "method": "deterministic_controller",
    "created_at": "2026-07-27T12:00:00Z",
    "tool": "sc-referee",
    "tool_version": "0.5.0"
  }
}
